{
  "contract": "coach.response.v1",
  "request_id": "coach-req-001",
  "run_id": "run-001",
  "mission_id": "KICKOFF-01",
  "stage_id": "S1",
  "coach_message": "지금 답변은 완료 시점과 산출물이 모호합니다. 날짜와 결과물을 함께 말해보세요.",
  "cards": [
    {
      "card_id": "deadline-clarity",
      "card_type": "error_correction",
      "severity": "warning",
      "title": "마감이 불명확합니다",
      "summary": "완료 날짜가 없어 상대방이 일정 기준을 판단하기 어렵습니다.",
      "details": {
        "observed": "사용자가 ‘최대한 빨리 준비하겠습니다’라고 답했습니다.",
        "expected": "완료 날짜 또는 확인 가능한 보고 시점을 명시해야 합니다.",
        "why_it_matters": "마감이 없으면 업무 우선순위와 후속 검토 일정을 합의할 수 없습니다.",
        "how_to_fix": [
          "요청받은 마감 기준을 다시 확인합니다.",
          "완료 가능한 날짜와 시간을 제시합니다.",
          "지연 가능성이 있으면 중간 보고 시점을 함께 말합니다."
        ],
        "example": "금요일 오후 3시까지 초안을 전달하고, 일정 변경이 생기면 목요일 오전에 먼저 보고드리겠습니다."
      },
      "evidence_refs": [
        {
          "event_id": "evt-001",
          "quote": "최대한 빨리 준비하겠습니다."
        }
      ],
      "source_chunk_ids": []
    },
    {
      "card_id": "deliverable-scope",
      "card_type": "requirement_check",
      "severity": "info",
      "title": "요구사항을 다시 확인해보세요",
      "summary": "준비할 결과물의 범위와 형식이 답변에 포함되지 않았습니다.",
      "details": {
        "observed": "사용자가 준비하겠다고만 답하고 산출물 종류를 확인하지 않았습니다.",
        "expected": "업무 목적, 결과물 형식, 포함 항목을 확인해야 합니다.",
        "why_it_matters": "범위를 확인하지 않으면 요청자와 다른 결과물을 만들 가능성이 커집니다.",
        "how_to_fix": [
          "필요한 결과물이 문서인지 발표자료인지 확인합니다.",
          "반드시 포함해야 할 항목을 질문합니다.",
          "확인한 범위를 짧게 재진술합니다."
        ],
        "example": "회의 안건 3개와 일정 계획을 포함한 한 페이지 요약본으로 준비하면 될까요?"
      },
      "evidence_refs": [
        {
          "event_id": "evt-001",
          "quote": "최대한 빨리 준비하겠습니다."
        }
      ],
      "source_chunk_ids": []
    },
    {
      "card_id": "professional-expression",
      "card_type": "better_expression",
      "severity": "success",
      "title": "더 좋은 표현 예시",
      "summary": "마감과 산출물을 함께 제시하면 업무 답변이 더 명확해집니다.",
      "details": {
        "observed": "의지는 표현했지만 실행 기준이 드러나지 않았습니다.",
        "expected": "상대방이 바로 확인할 수 있는 날짜·산출물·다음 행동을 포함합니다.",
        "why_it_matters": "구체적인 업무 표현은 불필요한 재질문을 줄이고 신뢰도를 높입니다.",
        "how_to_fix": [
          "‘빨리’ 대신 날짜와 시간을 사용합니다.",
          "무엇을 제출할지 구체적으로 말합니다.",
          "확인이 필요한 항목은 질문으로 마무리합니다."
        ],
        "example": "금요일 오후 3시까지 회의 안건과 일정 계획을 포함한 초안을 전달드리겠습니다. 이 형식으로 준비하면 될까요?"
      },
      "evidence_refs": [
        {
          "event_id": "evt-001",
          "quote": "최대한 빨리 준비하겠습니다."
        }
      ],
      "source_chunk_ids": []
    }
  ],
  "retry_instruction": "완료 날짜와 산출물 형식을 포함해 상사에게 다시 답해보세요."
}
